{
  "schema": "noss.mode/1",
  "id": "track",
  "name": "Track",
  "classes": ["official.track.touring", "official.track.gt", "official.track.stock_car", "official.track.prototype", "official.track.formula"],
  "tuning": { "allow": ["*"] },
  "assists": {
    "allowed": ["abs", "tcs", "stability", "auto_gearbox", "auto_clutch", "steer_aid", "racing_line", "auto_throttle", "brake_assist", "steering_assist", "autodrive"],
    "defaults": ["abs", "tcs", "auto_gearbox", "auto_clutch"]
  },
  "damage": { "cosmetic": true, "mechanical": false },
  "physics_layer": "none",
  "draft": { "range_m": 40.0, "half_width_m": 1.2, "drag_cut": 0.3, "lead_range_m": 10.0, "lead_cut": 0.04, "min_speed": 20.0 },
  "plate": { "light": 0.86, "medium": 0.75, "heavy": 0.65 }
}
