{
  "schema": "noss.mode/1",
  "id": "kart",
  "name": "Kart",
  "classes": ["official.kart.medium"],
  "tuning": { "allow": [] },
  "assists": { "allowed": ["auto_gearbox", "auto_clutch", "steer_aid"], "defaults": ["auto_gearbox", "auto_clutch"] },
  "damage": { "cosmetic": true, "mechanical": false },
  "physics_layer": "kart_arcade"
}
