{
  "schema": "noss.mode/1",
  "id": "highway",
  "name": "Highway",
  "classes": ["official.highway.street"],
  "tuning": { "allow": ["gearbox.final_drive", "brakes.bias_front"] },
  "assists": {
    "allowed": ["abs", "tcs", "stability", "auto_gearbox", "auto_clutch", "steer_aid"],
    "defaults": ["abs", "tcs", "stability", "auto_gearbox", "auto_clutch"]
  },
  "damage": { "cosmetic": true, "mechanical": false },
  "physics_layer": "none"
}
